<?xml version="1.0" encoding="UTF-8"?>
<!DOCTYPE ONTAP SYSTEM "file:///Users/zouhircharkaoui/Desktop/XML/ontap3.dtd">
<?xml-stylesheet type="text/xsl" href="ontap3.xsl"?>
<ONTAP>
    <Presentation>
        <Slide>
            <Title>Introduction à ONTAP</Title>
            <Image src="introd.png" alt="Introduction à ONTAP"/>
            <Text>Le système ONTAP, développé par NetApp, est une plateforme de gestion des données spécialement conçue pour les environnements d'entreprise. Sa technologie avancée facilite la gestion des données à grande échelle, permettant aux organisations d'accéder à leurs informations rapidement et en toute sécurité, tout en réduisant les coûts et en améliorant l'efficacité. ONTAP se distingue par sa capacité à s'intégrer parfaitement avec des infrastructures multi-cloud, ce qui permet aux entreprises de gérer leurs données dans des environnements hybrides et de garantir une flexibilité et une adaptabilité accrues. Ce système est conçu pour offrir des performances élevées, une résilience aux pannes et une sécurité avancée, répondant ainsi aux besoins critiques des entreprises modernes.</Text>
            <Advantage>Facilite la gestion et le partage de données dans des environnements multi-cloud, offrant aux entreprises une grande flexibilité.</Advantage>
            <Advantage>Assure une protection avancée des données avec des options de sauvegarde et de reprise après sinistre intégrées.</Advantage>
            <Advantage>Améliore les performances globales du système grâce à des fonctionnalités optimisées pour des environnements de stockage mixtes SAN et NAS.</Advantage>
        </Slide>
        <Slide>
            <Title>ités Clés d'ONTAP</Title>
            <Image src="ontap2.png" alt="Fonctionnalités Clés d'ONTAP"/>
            <Text>ONTAP propose une suite complète de fonctionnalités qui répondent aux exigences de gestion des données des entreprises modernes. Parmi celles-ci figurent la réplication des données, essentielle pour garantir une résilience accrue et la continuité des opérations, ainsi que la gestion des volumes, qui permet aux administrateurs de configurer et de personnaliser l'accès aux données de manière dynamique. De plus, ONTAP prend en charge les environnements SAN (Storage Area Network) et NAS (Network Attached Storage), permettant une intégration flexible avec diverses configurations de réseau. Grâce à des fonctionnalités comme les snapshots, les entreprises peuvent protéger leurs données contre les pertes accidentelles et assurer une restauration rapide en cas de besoin.</Text>
            <Advantage>Permet la réplication rapide et fiable des données entre différents sites géographiques pour garantir la continuité des opérations.</Advantage>
            <Advantage>Offre une gestion flexible des volumes avec la possibilité de créer des snapshots, assurant une protection continue des données.</Advantage>
            <Advantage>Compatible avec des environnements SAN et NAS, offrant une intégration sans faille avec les infrastructures existantes.</Advantage>
            <Advantage>Optimisation des performances grâce à des ajustements dynamiques en fonction des charges de travail et des besoins de l'entreprise.</Advantage>
        </Slide>
        <Slide>
            <Title>Avantages d'ONTAP pour les Entreprises</Title>
            <Image src="ontap.png" alt="Avantages d'ONTAP"/>
            <Text>ONTAP est conçu pour aider les entreprises à maximiser la valeur de leurs données tout en minimisant les risques et les coûts associés au stockage et à la gestion de grandes quantités d'informations. Grâce à ses capacités de haute disponibilité et de reprise après sinistre, ONTAP garantit que les données restent accessibles et sûres, même en cas de défaillance matérielle ou de panne réseau. Les entreprises peuvent également bénéficier de l'optimisation des ressources de stockage, ce qui se traduit par une réduction des coûts. Par ailleurs, ONTAP simplifie la gestion des données dans des environnements hybrides et multi-cloud, permettant aux organisations de tirer pleinement parti des infrastructures cloud tout en conservant un contrôle local sur leurs données sensibles.</Text>
            <Advantage>Réduction significative des coûts de stockage en optimisant l'utilisation des ressources disponibles.</Advantage>
            <Advantage>Haute disponibilité des données et continuité des opérations même en cas de panne système ou de sinistre.</Advantage>
            <Advantage>Facilité de gestion et de configuration des données dans des environnements hybrides et multi-cloud, offrant un contrôle total et une grande flexibilité.</Advantage>
            <Advantage>Protection avancée contre les pertes de données avec des solutions de sauvegarde et de réplication sophistiquées.</Advantage>
        </Slide>
        <Slide>
            <Title>Conclusion</Title>
            <Image src="con.png" alt="Conclusion sur ONTAP"/>
            <Text>En conclusion, ONTAP représente une solution de gestion des données complète et performante pour les entreprises modernes. Sa capacité à intégrer des infrastructures hybrides et multi-cloud tout en offrant une sécurité renforcée et une haute disponibilité fait de lui un choix stratégique pour les organisations qui souhaitent tirer le meilleur parti de leurs données. Les fonctionnalités avancées d'ONTAP, comme la réplication et la gestion flexible des volumes, garantissent que les données sont accessibles, sécurisées et prêtes à être utilisées à tout moment, même en cas de situations imprévues. Ce système s'avère donc être un atout essentiel pour les entreprises qui cherchent à améliorer leur résilience opérationnelle et leur efficacité tout en protégeant leurs actifs les plus précieux : leurs données.</Text>
        </Slide>
    </Presentation>
</ONTAP>
